{"$id":"https://github.com/rdemb/delta-witness/research/DW-001/schema/development-pilot-plan.schema.json","$schema":"https://json-schema.org/draft/2020-12/schema","additionalProperties":false,"description":"Sealed development-only ten-arm DW-001 mechanism-pilot plan. The plan contains no holdout authorization or confirmatory denominator.","properties":{"analysis_contract":{"additionalProperties":false,"properties":{"aggregate_release_requires_all_cases_valid":{"const":true},"contrast_ids":{"const":["candidate-test-discrimination","original-test-preservation","typed-import-error","declared-witness-mismatch","valid-positive-control"]},"ecological_inference_allowed":{"const":false},"headline_score_allowed":{"const":false},"retain_case_tables":{"const":true}},"required":["contrast_ids","retain_case_tables","headline_score_allowed","ecological_inference_allowed","aggregate_release_requires_all_cases_valid"],"type":"object"},"case_arms":{"items":{"$ref":"#/$defs/case_arm"},"maxItems":10,"minItems":10,"type":"array"},"claim_id":{"const":"role-check-regression"},"contracts":{"additionalProperties":false,"properties":{"claim_witness_declaration":{"const":"deltawitness.claim-witness-declaration.v1"},"claim_witness_localization":{"const":"deltawitness.claim-witness-localization.v1"},"fixture_descriptor":{"const":"deltawitness.dw001-fixture-descriptor.v1"},"fixture_identity":{"const":"deltawitness.dw001-fixture-identity.v1"},"fixture_manifest_binding":{"const":"deltawitness.dw001-fixture-manifest-binding.v1"},"matrix_report":{"const":"0.3"},"projection":{"const":"deltawitness.dw001-projection.v1"},"result_record":{"const":"deltawitness.dw001-result-record.v1"},"scenario_manifest":{"const":"deltawitness.dw001-scenario-manifest.v1"}},"required":["matrix_report","projection","fixture_descriptor","fixture_identity","fixture_manifest_binding","scenario_manifest","result_record","claim_witness_declaration","claim_witness_localization"],"type":"object"},"cost_contract":{"additionalProperties":false,"properties":{"measured_fields":{"const":["wall_clock_seconds","cpu_seconds","executed_matrix_states","executed_selector_states","command_count","artifact_count","public_bundle_bytes","review_time_minutes"]},"missing_numeric_value":{"const":null},"missing_reason_required":{"const":true},"negative_allowed":{"const":false},"nonfinite_allowed":{"const":false},"projected_method_native_cost_allowed":{"const":false}},"required":["measured_fields","missing_numeric_value","missing_reason_required","nonfinite_allowed","negative_allowed","projected_method_native_cost_allowed"],"type":"object"},"generator":{"additionalProperties":false,"properties":{"id":{"const":"deltawitness-synthetic-python"},"version":{"const":"1"}},"required":["id","version"],"type":"object"},"implementation_commit_sha":{"$ref":"#/$defs/git_sha"},"partition":{"const":"development"},"pilot_id":{"const":"DW-001-DEV-PILOT-V1"},"plan_sha256":{"$ref":"#/$defs/sha256"},"protocol_commit_sha":{"$ref":"#/$defs/git_sha"},"schema_version":{"const":"deltawitness.dw001-development-pilot-plan.v1"},"study_id":{"const":"DW-001"}},"required":["schema_version","study_id","pilot_id","partition","protocol_commit_sha","implementation_commit_sha","contracts","generator","claim_id","case_arms","analysis_contract","cost_contract","plan_sha256"],"title":"DeltaWitness DW-001 Development Mechanism Pilot Plan v1","type":"object","$defs":{"case_arm":{"additionalProperties":false,"properties":{"case_id":{"pattern":"^[A-Za-z0-9][A-Za-z0-9._-]{0,127}$","type":"string"},"control_role":{"enum":["valid-patch-control","false-assurance-case"]},"descriptor_sha256":{"$ref":"#/$defs/sha256"},"expected_methods":{"items":false,"maxItems":4,"minItems":4,"prefixItems":[{"$ref":"#/$defs/method","properties":{"method_id":{"const":"M0_FINAL"}}},{"$ref":"#/$defs/method","properties":{"method_id":{"const":"M1_F2P"}}},{"$ref":"#/$defs/method","properties":{"method_id":{"const":"M2_F2P_P2P"}}},{"$ref":"#/$defs/method","properties":{"method_id":{"const":"M3_FOUR_STATE"}}}],"type":"array"},"expected_states":{"items":false,"maxItems":4,"minItems":4,"prefixItems":[{"$ref":"#/$defs/state","properties":{"state":{"const":"base_base"}}},{"$ref":"#/$defs/state","properties":{"state":{"const":"base_candidate"}}},{"$ref":"#/$defs/state","properties":{"state":{"const":"candidate_base"}}},{"$ref":"#/$defs/state","properties":{"state":{"const":"candidate_candidate"}}}],"type":"array"},"family_id":{"enum":["valid-discriminating-regression","non-discriminating-candidate-test","candidate-regression-against-base-tests","wrong-reason-base-import-failure","wrong-reason-unrelated-assertion"]},"localization":{"$ref":"#/$defs/localization"},"observer":{"enum":["exit-code-v1","outcome-receipt-v1"]},"observer_id":{"enum":["O0_EXIT_CODE","O1_TYPED_RECEIPT"]},"order":{"maximum":10,"minimum":1,"type":"integer"},"partition":{"const":"development"},"primary_denominator_eligible":{"const":false},"scenario_id":{"pattern":"^[A-Za-z0-9][A-Za-z0-9._-]{0,127}$","type":"string"},"spec_sha256":{"$ref":"#/$defs/sha256"}},"required":["order","case_id","scenario_id","family_id","observer","observer_id","control_role","partition","primary_denominator_eligible","descriptor_sha256","spec_sha256","expected_states","expected_methods","localization"],"type":"object"},"git_sha":{"pattern":"^[0-9a-f]{40}$","type":"string"},"localization":{"additionalProperties":false,"properties":{"aggregate_rule":{"enum":["at_least_one_discriminating_and_none_indeterminate",null]},"declaration_sha256":{"anyOf":[{"$ref":"#/$defs/sha256"},{"type":"null"}]},"expected_status":{"enum":["supported","unsupported","indeterminate","not_applicable"]},"required":{"type":"boolean"},"selectors":{"items":{"pattern":"^[A-Za-z_][A-Za-z0-9_]*(\\.[A-Za-z_][A-Za-z0-9_]*){2,}$","type":"string"},"type":"array","uniqueItems":true}},"required":["required","selectors","aggregate_rule","declaration_sha256","expected_status"],"type":"object"},"method":{"additionalProperties":false,"properties":{"decision":{"enum":["accept","reject","indeterminate","not_applicable"]},"method_id":{"enum":["M0_FINAL","M1_F2P","M2_F2P_P2P","M3_FOUR_STATE"]},"reason_code":{"enum":["predicate_satisfied","predicate_contradicted","required_state_indeterminate","required_state_not_applicable"]}},"required":["method_id","decision","reason_code"],"type":"object"},"sha256":{"pattern":"^[0-9a-f]{64}$","type":"string"},"state":{"additionalProperties":false,"properties":{"applicable":{"type":"boolean"},"expected_observed":{"enum":["pass","fail","error","timeout"]},"failure_cause":{"enum":["none","assertion_failure","test_failure_untyped","import_error","timeout","unknown_error"]},"state":{"enum":["base_base","base_candidate","candidate_base","candidate_candidate"]}},"required":["state","applicable","expected_observed","failure_cause"],"type":"object"}}}
