{"analysis_contract":{"aggregate_release_requires_all_cases_valid":true,"contrast_ids":["candidate-test-discrimination","original-test-preservation","typed-import-error","declared-witness-mismatch","valid-positive-control"],"ecological_inference_allowed":false,"headline_score_allowed":false,"retain_case_tables":true},"case_arms":[{"case_id":"dev-v1-valid-o0","control_role":"valid-patch-control","descriptor_sha256":"4bf854cfcb52ed5542c3b3897a8df00fad1cb7c7450a204ab71d4f313a45966b","expected_methods":[{"decision":"accept","method_id":"M0_FINAL","reason_code":"predicate_satisfied"},{"decision":"accept","method_id":"M1_F2P","reason_code":"predicate_satisfied"},{"decision":"accept","method_id":"M2_F2P_P2P","reason_code":"predicate_satisfied"},{"decision":"accept","method_id":"M3_FOUR_STATE","reason_code":"predicate_satisfied"}],"expected_states":[{"applicable":true,"expected_observed":"pass","failure_cause":"none","state":"base_base"},{"applicable":true,"expected_observed":"fail","failure_cause":"test_failure_untyped","state":"base_candidate"},{"applicable":true,"expected_observed":"pass","failure_cause":"none","state":"candidate_base"},{"applicable":true,"expected_observed":"pass","failure_cause":"none","state":"candidate_candidate"}],"family_id":"valid-discriminating-regression","localization":{"aggregate_rule":"at_least_one_discriminating_and_none_indeterminate","declaration_sha256":"e3f26814cba869f6e8d3cb9ee91d6f3cd01e9505e27ca1a16650c1c20972071e","expected_status":"supported","required":true,"selectors":["test_access.AccessTests.test_viewer_is_denied"]},"observer":"exit-code-v1","observer_id":"O0_EXIT_CODE","order":1,"partition":"development","primary_denominator_eligible":false,"scenario_id":"dev-v1-valid-o0","spec_sha256":"ae172da9648d0f72e06979e8510d8f804a1cf5cc1d2ffda9791cafe981e7f4c3"},{"case_id":"dev-v1-valid-o1","control_role":"valid-patch-control","descriptor_sha256":"ede9ef6c43f098d4538a1c14d3c0b7fcbc99571c1ecf18e9bb0bf65557bdc460","expected_methods":[{"decision":"accept","method_id":"M0_FINAL","reason_code":"predicate_satisfied"},{"decision":"accept","method_id":"M1_F2P","reason_code":"predicate_satisfied"},{"decision":"accept","method_id":"M2_F2P_P2P","reason_code":"predicate_satisfied"},{"decision":"accept","method_id":"M3_FOUR_STATE","reason_code":"predicate_satisfied"}],"expected_states":[{"applicable":true,"expected_observed":"pass","failure_cause":"none","state":"base_base"},{"applicable":true,"expected_observed":"fail","failure_cause":"assertion_failure","state":"base_candidate"},{"applicable":true,"expected_observed":"pass","failure_cause":"none","state":"candidate_base"},{"applicable":true,"expected_observed":"pass","failure_cause":"none","state":"candidate_candidate"}],"family_id":"valid-discriminating-regression","localization":{"aggregate_rule":"at_least_one_discriminating_and_none_indeterminate","declaration_sha256":"b1ca31b32d4d304076f72b5475be06afac0718e6aaf7921d13fa6d09eed824e4","expected_status":"supported","required":true,"selectors":["test_access.AccessTests.test_viewer_is_denied"]},"observer":"outcome-receipt-v1","observer_id":"O1_TYPED_RECEIPT","order":2,"partition":"development","primary_denominator_eligible":false,"scenario_id":"dev-v1-valid-o1","spec_sha256":"e271d3654f4a34615d309f7af79a2553420f8b8cee12fc0af1635cff13e5594f"},{"case_id":"dev-v1-nondiscriminating-o0","control_role":"false-assurance-case","descriptor_sha256":"36a29dd8db3083dc157f31782ce7ea429150c7fc46ee3de0f3c160109e8686ca","expected_methods":[{"decision":"accept","method_id":"M0_FINAL","reason_code":"predicate_satisfied"},{"decision":"reject","method_id":"M1_F2P","reason_code":"predicate_contradicted"},{"decision":"reject","method_id":"M2_F2P_P2P","reason_code":"predicate_contradicted"},{"decision":"reject","method_id":"M3_FOUR_STATE","reason_code":"predicate_contradicted"}],"expected_states":[{"applicable":true,"expected_observed":"pass","failure_cause":"none","state":"base_base"},{"applicable":true,"expected_observed":"pass","failure_cause":"none","state":"base_candidate"},{"applicable":true,"expected_observed":"pass","failure_cause":"none","state":"candidate_base"},{"applicable":true,"expected_observed":"pass","failure_cause":"none","state":"candidate_candidate"}],"family_id":"non-discriminating-candidate-test","localization":{"aggregate_rule":null,"declaration_sha256":null,"expected_status":"not_applicable","required":false,"selectors":[]},"observer":"exit-code-v1","observer_id":"O0_EXIT_CODE","order":3,"partition":"development","primary_denominator_eligible":false,"scenario_id":"dev-v1-nondiscriminating-o0","spec_sha256":"ae172da9648d0f72e06979e8510d8f804a1cf5cc1d2ffda9791cafe981e7f4c3"},{"case_id":"dev-v1-nondiscriminating-o1","control_role":"false-assurance-case","descriptor_sha256":"9ce7941bd4e2f007a0d9e6b6b90cef9a397942b84b9d413b1ba5e98463a29a5c","expected_methods":[{"decision":"accept","method_id":"M0_FINAL","reason_code":"predicate_satisfied"},{"decision":"reject","method_id":"M1_F2P","reason_code":"predicate_contradicted"},{"decision":"reject","method_id":"M2_F2P_P2P","reason_code":"predicate_contradicted"},{"decision":"reject","method_id":"M3_FOUR_STATE","reason_code":"predicate_contradicted"}],"expected_states":[{"applicable":true,"expected_observed":"pass","failure_cause":"none","state":"base_base"},{"applicable":true,"expected_observed":"pass","failure_cause":"none","state":"base_candidate"},{"applicable":true,"expected_observed":"pass","failure_cause":"none","state":"candidate_base"},{"applicable":true,"expected_observed":"pass","failure_cause":"none","state":"candidate_candidate"}],"family_id":"non-discriminating-candidate-test","localization":{"aggregate_rule":null,"declaration_sha256":null,"expected_status":"not_applicable","required":false,"selectors":[]},"observer":"outcome-receipt-v1","observer_id":"O1_TYPED_RECEIPT","order":4,"partition":"development","primary_denominator_eligible":false,"scenario_id":"dev-v1-nondiscriminating-o1","spec_sha256":"e271d3654f4a34615d309f7af79a2553420f8b8cee12fc0af1635cff13e5594f"},{"case_id":"dev-v1-candidate-regression-o0","control_role":"false-assurance-case","descriptor_sha256":"685dc45d83b001a6d57f9552e31aedbb687a91edf48851bbba528324b467f3a2","expected_methods":[{"decision":"accept","method_id":"M0_FINAL","reason_code":"predicate_satisfied"},{"decision":"accept","method_id":"M1_F2P","reason_code":"predicate_satisfied"},{"decision":"reject","method_id":"M2_F2P_P2P","reason_code":"predicate_contradicted"},{"decision":"reject","method_id":"M3_FOUR_STATE","reason_code":"predicate_contradicted"}],"expected_states":[{"applicable":true,"expected_observed":"pass","failure_cause":"none","state":"base_base"},{"applicable":true,"expected_observed":"fail","failure_cause":"test_failure_untyped","state":"base_candidate"},{"applicable":true,"expected_observed":"fail","failure_cause":"test_failure_untyped","state":"candidate_base"},{"applicable":true,"expected_observed":"pass","failure_cause":"none","state":"candidate_candidate"}],"family_id":"candidate-regression-against-base-tests","localization":{"aggregate_rule":null,"declaration_sha256":null,"expected_status":"not_applicable","required":false,"selectors":[]},"observer":"exit-code-v1","observer_id":"O0_EXIT_CODE","order":5,"partition":"development","primary_denominator_eligible":false,"scenario_id":"dev-v1-candidate-regression-o0","spec_sha256":"ae172da9648d0f72e06979e8510d8f804a1cf5cc1d2ffda9791cafe981e7f4c3"},{"case_id":"dev-v1-candidate-regression-o1","control_role":"false-assurance-case","descriptor_sha256":"8d5281b4cdd17dd85e22138ba82ec86014a0e2d0903fabb3f4166b33217689c2","expected_methods":[{"decision":"accept","method_id":"M0_FINAL","reason_code":"predicate_satisfied"},{"decision":"accept","method_id":"M1_F2P","reason_code":"predicate_satisfied"},{"decision":"reject","method_id":"M2_F2P_P2P","reason_code":"predicate_contradicted"},{"decision":"reject","method_id":"M3_FOUR_STATE","reason_code":"predicate_contradicted"}],"expected_states":[{"applicable":true,"expected_observed":"pass","failure_cause":"none","state":"base_base"},{"applicable":true,"expected_observed":"fail","failure_cause":"assertion_failure","state":"base_candidate"},{"applicable":true,"expected_observed":"fail","failure_cause":"assertion_failure","state":"candidate_base"},{"applicable":true,"expected_observed":"pass","failure_cause":"none","state":"candidate_candidate"}],"family_id":"candidate-regression-against-base-tests","localization":{"aggregate_rule":null,"declaration_sha256":null,"expected_status":"not_applicable","required":false,"selectors":[]},"observer":"outcome-receipt-v1","observer_id":"O1_TYPED_RECEIPT","order":6,"partition":"development","primary_denominator_eligible":false,"scenario_id":"dev-v1-candidate-regression-o1","spec_sha256":"e271d3654f4a34615d309f7af79a2553420f8b8cee12fc0af1635cff13e5594f"},{"case_id":"dev-v1-import-error-o0","control_role":"false-assurance-case","descriptor_sha256":"512c6c0d81b3a89d1125f17cc9adbed290b84d522559435514e5b8e47b4f1956","expected_methods":[{"decision":"accept","method_id":"M0_FINAL","reason_code":"predicate_satisfied"},{"decision":"accept","method_id":"M1_F2P","reason_code":"predicate_satisfied"},{"decision":"accept","method_id":"M2_F2P_P2P","reason_code":"predicate_satisfied"},{"decision":"accept","method_id":"M3_FOUR_STATE","reason_code":"predicate_satisfied"}],"expected_states":[{"applicable":true,"expected_observed":"pass","failure_cause":"none","state":"base_base"},{"applicable":true,"expected_observed":"fail","failure_cause":"test_failure_untyped","state":"base_candidate"},{"applicable":true,"expected_observed":"pass","failure_cause":"none","state":"candidate_base"},{"applicable":true,"expected_observed":"pass","failure_cause":"none","state":"candidate_candidate"}],"family_id":"wrong-reason-base-import-failure","localization":{"aggregate_rule":"at_least_one_discriminating_and_none_indeterminate","declaration_sha256":"1dfbddca795910843e4e6cf4d19c1ed4af51bcd239d766bf080902b9537da0e2","